{
  "schema_version": "opsmind-cross-service-evaluation-export-v1",
  "evidence_classification": "REGRESSION_SNAPSHOT_NOT_PRODUCTION_PATH",
  "query_manifest": {
    "reference": "repository://scripts/validation/cross-service/cross-service-evaluation-export.sql",
    "byte_digest": "sha256:eeeeeeeeeeeeeeeeeeeeeeeeeeeeeeeeeeeeeeeeeeeeeeeeeeeeeeeeeeeeeeee"
  },
  "scope": {
    "organization_id": "10000000-0000-4000-8000-000000000801",
    "project_id": "10000000-0000-4000-8000-000000000802",
    "incident_id": "10000000-0000-4000-8000-000000000814",
    "run_id": "10000000-0000-4000-8000-000000000811",
    "actor_id": "10000000-0000-4000-8000-000000000816"
  },
  "run": {
    "run_id": "10000000-0000-4000-8000-000000000811",
    "organization_id": "10000000-0000-4000-8000-000000000801",
    "project_id": "10000000-0000-4000-8000-000000000802",
    "incident_id": "10000000-0000-4000-8000-000000000814",
    "actor_id": "10000000-0000-4000-8000-000000000816",
    "status": "COMPLETED",
    "rounds": 2,
    "tool_calls": 1,
    "total_tokens": 64,
    "event_count": 6,
    "evidence_ids": [
      "10000000-0000-4000-8000-000000000813"
    ],
    "pending_intents": [],
    "terminal_reason": null,
    "started_at": "2030-01-01T00:00:00Z",
    "deadline_at": "2030-01-01T00:02:00Z",
    "ended_at": "2030-01-01T00:00:05Z"
  },
  "events": [
    {
      "event_id": "10000000-0000-4000-8000-000000000821",
      "sequence_no": 1,
      "event_type": "RUN_STARTED",
      "occurred_at": "2030-01-01T00:00:00Z",
      "accepted_analysis": null
    },
    {
      "event_id": "10000000-0000-4000-8000-000000000822",
      "sequence_no": 2,
      "event_type": "ANALYSIS_ACCEPTED",
      "occurred_at": "2030-01-01T00:00:01Z",
      "accepted_analysis": {
        "status": "need_more_evidence",
        "run_id": "10000000-0000-4000-8000-000000000811",
        "model_id": "deepseek-v4-flash",
        "prompt_version": "prompt-incident-investigation-v1",
        "schema_version": "analysis-v1",
        "hypotheses": [],
        "counter_evidence": [],
        "missing_evidence": [
          "Synthetic latency metrics are required."
        ],
        "citations": [],
        "confidence": 0.2,
        "usage": {
          "prompt_tokens": 10,
          "completion_tokens": 10,
          "total_tokens": 20
        },
        "cost_estimate": {
          "currency": "USD",
          "amount": 0
        },
        "requested_tool_calls": [
          {
            "intent_id": "10000000-0000-4000-8000-000000000817",
            "connector": "metrics",
            "operation": "query",
            "arguments_digest": "sha256:51ef8c2e4e2926e103ddd877490c64d604b1df593ca23cffca8d1b2fac5d8700",
            "rationale": "Read synthetic latency metrics."
          }
        ]
      }
    },
    {
      "event_id": "10000000-0000-4000-8000-000000000823",
      "sequence_no": 3,
      "event_type": "TOOL_REQUESTED",
      "occurred_at": "2030-01-01T00:00:01Z",
      "accepted_analysis": null
    },
    {
      "event_id": "10000000-0000-4000-8000-000000000824",
      "sequence_no": 4,
      "event_type": "EVIDENCE_APPENDED",
      "occurred_at": "2030-01-01T00:00:03Z",
      "accepted_analysis": null
    },
    {
      "event_id": "10000000-0000-4000-8000-000000000825",
      "sequence_no": 5,
      "event_type": "ANALYSIS_ACCEPTED",
      "occurred_at": "2030-01-01T00:00:05Z",
      "accepted_analysis": {
        "status": "complete",
        "run_id": "10000000-0000-4000-8000-000000000811",
        "model_id": "deepseek-v4-flash",
        "prompt_version": "prompt-incident-investigation-v1",
        "schema_version": "analysis-v1",
        "hypotheses": [
          {
            "title": "Synthetic latency regression",
            "explanation": "Synthetic latency increased after the deployment marker.",
            "confidence": 0.82,
            "citations": [
              {
                "evidence_id": "10000000-0000-4000-8000-000000000813",
                "digest": "sha256:aaaaaaaaaaaaaaaaaaaaaaaaaaaaaaaaaaaaaaaaaaaaaaaaaaaaaaaaaaaaaaaa",
                "claim": "Synthetic evidence supports the regression."
              }
            ]
          }
        ],
        "counter_evidence": [],
        "missing_evidence": [],
        "citations": [
          {
            "evidence_id": "10000000-0000-4000-8000-000000000813",
            "digest": "sha256:aaaaaaaaaaaaaaaaaaaaaaaaaaaaaaaaaaaaaaaaaaaaaaaaaaaaaaaaaaaaaaaa",
            "claim": "Synthetic evidence supports the regression."
          }
        ],
        "confidence": 0.82,
        "usage": {
          "prompt_tokens": 30,
          "completion_tokens": 14,
          "total_tokens": 44
        },
        "cost_estimate": {
          "currency": "USD",
          "amount": 0
        },
        "requested_tool_calls": []
      }
    },
    {
      "event_id": "10000000-0000-4000-8000-000000000826",
      "sequence_no": 6,
      "event_type": "COMPLETED",
      "occurred_at": "2030-01-01T00:00:05Z",
      "accepted_analysis": null
    }
  ],
  "evidence_records": [
    {
      "evidence_id": "10000000-0000-4000-8000-000000000813",
      "organization_id": "10000000-0000-4000-8000-000000000801",
      "project_id": "10000000-0000-4000-8000-000000000802",
      "incident_id": "10000000-0000-4000-8000-000000000814",
      "run_id": "10000000-0000-4000-8000-000000000811",
      "actor_id": "10000000-0000-4000-8000-000000000816",
      "intent_id": "10000000-0000-4000-8000-000000000817",
      "execution_id": "10000000-0000-4000-8000-000000000815",
      "investigation_event_id": "10000000-0000-4000-8000-000000000824",
      "gateway_audit_event_id": "10000000-0000-4000-8000-000000000818",
      "gateway_request_digest": "sha256:bbbbbbbbbbbbbbbbbbbbbbbbbbbbbbbbbbbbbbbbbbbbbbbbbbbbbbbbbbbbbbbb",
      "source_type": "metric",
      "source_identity": "prometheus:synthetic/opsmind-api",
      "target_identity": "service:opsmind-api",
      "observed_at": "2030-01-01T00:00:03Z",
      "window_start": "2030-01-01T00:00:00Z",
      "window_end": "2030-01-01T00:00:03Z",
      "connector_version": "prometheus-loopback-v1",
      "manifest_version": "observability.metrics.query@1",
      "policy_version": "tool-policy-v1",
      "source_provenance": "synthetic-cross-service-regression",
      "trust_class": "synthetic",
      "content_digest": "sha256:aaaaaaaaaaaaaaaaaaaaaaaaaaaaaaaaaaaaaaaaaaaaaaaaaaaaaaaaaaaaaaaa",
      "redacted_fields": 0,
      "truncated": false,
      "gateway_duplicate": false,
      "created_at": "2030-01-01T00:00:03Z"
    }
  ],
  "analysis_invocations": [
    {
      "invocation_id": "10000000-0000-4000-8000-000000000831",
      "organization_id": "10000000-0000-4000-8000-000000000801",
      "incident_id": "10000000-0000-4000-8000-000000000814",
      "run_id": "10000000-0000-4000-8000-000000000811",
      "state": "succeeded",
      "response_status": "need_more_evidence",
      "response_payload": {
        "status": "need_more_evidence",
        "run_id": "10000000-0000-4000-8000-000000000811",
        "model_id": "deepseek-v4-flash",
        "prompt_version": "prompt-incident-investigation-v1",
        "schema_version": "analysis-v1",
        "hypotheses": [],
        "counter_evidence": [],
        "missing_evidence": [
          "Synthetic latency metrics are required."
        ],
        "citations": [],
        "confidence": 0.2,
        "usage": {
          "prompt_tokens": 10,
          "completion_tokens": 10,
          "total_tokens": 20
        },
        "cost_estimate": {
          "currency": "USD",
          "amount": 0
        },
        "requested_tool_calls": [
          {
            "intent_id": "10000000-0000-4000-8000-000000000817",
            "connector": "metrics",
            "operation": "query",
            "arguments_digest": "sha256:51ef8c2e4e2926e103ddd877490c64d604b1df593ca23cffca8d1b2fac5d8700",
            "rationale": "Read synthetic latency metrics."
          }
        ]
      },
      "provider": "fixture",
      "model_id": "deepseek-v4-flash",
      "prompt_version": "prompt-incident-investigation-v1",
      "schema_version": "analysis-v1",
      "actual_tokens": 20,
      "actual_tools": 1,
      "actual_cost_usd": 0,
      "started_at": "2030-01-01T00:00:00Z",
      "finished_at": "2030-01-01T00:00:01Z"
    },
    {
      "invocation_id": "10000000-0000-4000-8000-000000000832",
      "organization_id": "10000000-0000-4000-8000-000000000801",
      "incident_id": "10000000-0000-4000-8000-000000000814",
      "run_id": "10000000-0000-4000-8000-000000000811",
      "state": "succeeded",
      "response_status": "complete",
      "response_payload": {
        "status": "complete",
        "run_id": "10000000-0000-4000-8000-000000000811",
        "model_id": "deepseek-v4-flash",
        "prompt_version": "prompt-incident-investigation-v1",
        "schema_version": "analysis-v1",
        "hypotheses": [
          {
            "title": "Synthetic latency regression",
            "explanation": "Synthetic latency increased after the deployment marker.",
            "confidence": 0.82,
            "citations": [
              {
                "evidence_id": "10000000-0000-4000-8000-000000000813",
                "digest": "sha256:aaaaaaaaaaaaaaaaaaaaaaaaaaaaaaaaaaaaaaaaaaaaaaaaaaaaaaaaaaaaaaaa",
                "claim": "Synthetic evidence supports the regression."
              }
            ]
          }
        ],
        "counter_evidence": [],
        "missing_evidence": [],
        "citations": [
          {
            "evidence_id": "10000000-0000-4000-8000-000000000813",
            "digest": "sha256:aaaaaaaaaaaaaaaaaaaaaaaaaaaaaaaaaaaaaaaaaaaaaaaaaaaaaaaaaaaaaaaa",
            "claim": "Synthetic evidence supports the regression."
          }
        ],
        "confidence": 0.82,
        "usage": {
          "prompt_tokens": 30,
          "completion_tokens": 14,
          "total_tokens": 44
        },